{
  "$schema": "http://json-schema.org/draft-07/schema#",
  "$id": "vocabularyCollection.schema.json",
  "title": "Vocabulary Collection Schema",
  "description": "JSON Schema для валидации коллекций словаря (отдельные файлы коллекций)",
  "type": "object",
  "required": ["id", "name", "categories"],
  "properties": {
    "id": {
      "type": "string",
      "minLength": 1,
      "pattern": "^[a-z0-9-]+$",
      "description": "Идентификатор подборки (только строчные буквы, цифры и дефисы)"
    },
    "name": {
      "type": "string",
      "minLength": 1,
      "description": "Название подборки"
    },
    "description": {
      "type": "string",
      "description": "Описание подборки (опционально)"
    },
    "categories": {
      "type": "object",
      "description": "Объект категорий, где ключ - название категории, значение - массив слов",
      "patternProperties": {
        "^(phrases|verbs|nouns|adjectives)$": {
          "type": "array",
          "minItems": 0,
          "items": {
            "$ref": "#/definitions/Word"
          }
        }
      },
      "additionalProperties": false
    }
  },
  "definitions": {
    "Word": {
      "type": "object",
      "required": ["id", "english", "translation", "category"],
      "properties": {
        "id": {
          "type": "string",
          "minLength": 1,
          "description": "Уникальный идентификатор слова"
        },
        "english": {
          "type": "string",
          "minLength": 1,
          "description": "Английское слово или фраза"
        },
        "translation": {
          "type": "string",
          "minLength": 1,
          "description": "Перевод на русский язык"
        },
        "definition": {
          "type": "string",
          "description": "Определение на английском (опционально)"
        },
        "example": {
          "type": "string",
          "description": "Пример использования (опционально)"
        },
        "category": {
          "type": "string",
          "enum": ["phrases", "verbs", "nouns", "adjectives"],
          "description": "Основная категория слова"
        },
        "subcategory": {
          "type": "string",
          "description": "Подкатегория для более тонкой классификации (опционально)"
        },
        "tags": {
          "type": "array",
          "description": "Массив тегов для множественных связей с подборками (опционально)",
          "items": {
            "type": "string",
            "minLength": 1
          },
          "uniqueItems": true
        },
        "irregularForms": {
          "type": "object",
          "description": "Три формы неправильного глагола (опционально, только для irregularVerbs)",
          "properties": {
            "past": {
              "type": "string",
              "minLength": 1,
              "description": "Вторая форма (Past Simple), например 'was/were'"
            },
            "pastParticiple": {
              "type": "string",
              "minLength": 1,
              "description": "Третья форма (Past Participle), например 'been'"
            }
          },
          "required": ["past", "pastParticiple"],
          "additionalProperties": false
        }
      },
      "additionalProperties": false
    }
  },
  "additionalProperties": false
}

