{
  "id": "irregular-verbs",
  "name": "Irregular Verbs",
  "description": "Неправильные глаголы уровня A1",
  "categories": {
    "verbs": [
      {
        "id": "be-1",
        "english": "be",
        "translation": "быть",
        "category": "verbs",
        "subcategory": "irregularVerbs",
        "irregularForms": {
          "past": "was/were",
          "pastParticiple": "been"
        },
        "tags": [
          "difficulty-a1",
          "auxiliaryVerbs"
        ]
      },
      {
        "id": "have-1",
        "english": "have",
        "translation": "иметь",
        "category": "verbs",
        "subcategory": "irregularVerbs",
        "irregularForms": {
          "past": "had",
          "pastParticiple": "had"
        },
        "tags": [
          "difficulty-a1",
          "auxiliaryVerbs"
        ]
      },
      {
        "id": "do-1",
        "english": "do",
        "translation": "делать",
        "category": "verbs",
        "subcategory": "irregularVerbs",
        "irregularForms": {
          "past": "did",
          "pastParticiple": "done"
        },
        "tags": [
          "difficulty-a1",
          "auxiliaryVerbs"
        ]
      },
      {
        "id": "go-1",
        "english": "go",
        "translation": "идти / ехать",
        "category": "verbs",
        "subcategory": "irregularVerbs",
        "irregularForms": {
          "past": "went",
          "pastParticiple": "gone"
        },
        "tags": [
          "difficulty-a1"
        ]
      },
      {
        "id": "see-1",
        "english": "see",
        "translation": "видеть",
        "category": "verbs",
        "subcategory": "irregularVerbs",
        "irregularForms": {
          "past": "saw",
          "pastParticiple": "seen"
        },
        "tags": [
          "difficulty-a1"
        ]
      },
      {
        "id": "say-1",
        "english": "say",
        "translation": "говорить",
        "category": "verbs",
        "subcategory": "irregularVerbs",
        "irregularForms": {
          "past": "said",
          "pastParticiple": "said"
        },
        "tags": [
          "difficulty-a1"
        ]
      },
      {
        "id": "get-1",
        "english": "get",
        "translation": "получать",
        "category": "verbs",
        "subcategory": "irregularVerbs",
        "irregularForms": {
          "past": "got",
          "pastParticiple": "got"
        },
        "tags": [
          "difficulty-a1"
        ]
      },
      {
        "id": "make-1",
        "english": "make",
        "translation": "делать / готовить",
        "category": "verbs",
        "subcategory": "irregularVerbs",
        "irregularForms": {
          "past": "made",
          "pastParticiple": "made"
        },
        "tags": [
          "difficulty-a1"
        ]
      },
      {
        "id": "take-1",
        "english": "take",
        "translation": "брать",
        "category": "verbs",
        "subcategory": "irregularVerbs",
        "irregularForms": {
          "past": "took",
          "pastParticiple": "taken"
        },
        "tags": [
          "difficulty-a1"
        ]
      },
      {
        "id": "come-1",
        "english": "come",
        "translation": "приходить",
        "category": "verbs",
        "subcategory": "irregularVerbs",
        "irregularForms": {
          "past": "came",
          "pastParticiple": "come"
        },
        "tags": [
          "difficulty-a1"
        ]
      },
      {
        "id": "give-1",
        "english": "give",
        "translation": "давать",
        "category": "verbs",
        "subcategory": "irregularVerbs",
        "irregularForms": {
          "past": "gave",
          "pastParticiple": "given"
        },
        "tags": [
          "difficulty-a1"
        ]
      },
      {
        "id": "eat-1",
        "english": "eat",
        "translation": "есть",
        "category": "verbs",
        "subcategory": "irregularVerbs",
        "irregularForms": {
          "past": "ate",
          "pastParticiple": "eaten"
        },
        "tags": [
          "topic-daily-routine",
          "difficulty-a1"
        ]
      },
      {
        "id": "drink-1",
        "english": "drink",
        "translation": "пить",
        "category": "verbs",
        "subcategory": "irregularVerbs",
        "irregularForms": {
          "past": "drank",
          "pastParticiple": "drunk"
        },
        "tags": [
          "topic-daily-routine",
          "difficulty-a1"
        ]
      },
      {
        "id": "sleep-1",
        "english": "sleep",
        "translation": "спать",
        "category": "verbs",
        "subcategory": "irregularVerbs",
        "irregularForms": {
          "past": "slept",
          "pastParticiple": "slept"
        },
        "tags": [
          "topic-daily-routine",
          "difficulty-a1"
        ]
      },
      {
        "id": "read-1",
        "english": "read",
        "translation": "читать",
        "category": "verbs",
        "subcategory": "irregularVerbs",
        "irregularForms": {
          "past": "read",
          "pastParticiple": "read"
        },
        "tags": [
          "difficulty-a1"
        ]
      },
      {
        "id": "buy-1",
        "english": "buy",
        "translation": "покупать",
        "category": "verbs",
        "subcategory": "irregularVerbs",
        "irregularForms": {
          "past": "bought",
          "pastParticiple": "bought"
        },
        "tags": [
          "difficulty-a1"
        ]
      }
    ]
  }
}
