{
  "id": "phrasal-verbs",
  "name": "Phrasal Verbs",
  "description": "Фразовые глаголы уровня A1",
  "categories": {
    "verbs": [
      {
        "id": "get-up-1",
        "english": "get up",
        "translation": "вставать",
        "category": "verbs",
        "subcategory": "phrasalVerbs",
        "tags": [
          "common",
          "daily-life",
          "phrasal-verbs"
        ]
      },
      {
        "id": "go-out-1",
        "english": "go out",
        "translation": "выходить",
        "category": "verbs",
        "subcategory": "phrasalVerbs",
        "tags": [
          "common",
          "phrasal-verbs"
        ]
      },
      {
        "id": "come-in-1",
        "english": "come in",
        "translation": "входить",
        "category": "verbs",
        "subcategory": "phrasalVerbs",
        "tags": [
          "common",
          "phrasal-verbs"
        ]
      },
      {
        "id": "look-for-1",
        "english": "look for",
        "translation": "искать",
        "category": "verbs",
        "subcategory": "phrasalVerbs",
        "tags": [
          "common",
          "phrasal-verbs"
        ]
      },
      {
        "id": "turn-on-1",
        "english": "turn on",
        "translation": "включать",
        "category": "verbs",
        "subcategory": "phrasalVerbs",
        "tags": [
          "common",
          "phrasal-verbs"
        ]
      },
      {
        "id": "turn-off-1",
        "english": "turn off",
        "translation": "выключать",
        "category": "verbs",
        "subcategory": "phrasalVerbs",
        "tags": [
          "common",
          "phrasal-verbs"
        ]
      },
      {
        "id": "put-on-1",
        "english": "put on",
        "translation": "надевать",
        "category": "verbs",
        "subcategory": "phrasalVerbs",
        "tags": [
          "common",
          "phrasal-verbs"
        ]
      },
      {
        "id": "take-off-1",
        "english": "take off",
        "translation": "снимать (одежду)",
        "category": "verbs",
        "subcategory": "phrasalVerbs",
        "tags": [
          "common",
          "phrasal-verbs"
        ]
      },
      {
        "id": "wake-up-1",
        "english": "wake up",
        "translation": "просыпаться",
        "category": "verbs",
        "subcategory": "phrasalVerbs",
        "tags": [
          "common",
          "daily-life",
          "phrasal-verbs"
        ]
      },
      {
        "id": "sit-down-1",
        "english": "sit down",
        "translation": "садиться",
        "category": "verbs",
        "subcategory": "phrasalVerbs",
        "tags": [
          "common",
          "phrasal-verbs"
        ]
      }
    ]
  }
}
