{
  "id": "basic-verbs",
  "name": "Basic English Verbs",
  "description": "Основные английские глаголы уровня A1",
  "categories": {
    "verbs": [
      {
        "id": "play-1",
        "english": "play",
        "translation": "играть",
        "category": "verbs",
        "subcategory": "regularVerbs",
        "tags": [
          "common"
        ]
      },
      {
        "id": "watch-1",
        "english": "watch",
        "translation": "смотреть",
        "category": "verbs",
        "subcategory": "regularVerbs",
        "tags": [
          "common"
        ]
      },
      {
        "id": "listen-1",
        "english": "listen",
        "translation": "слушать",
        "category": "verbs",
        "subcategory": "regularVerbs",
        "tags": [
          "common"
        ]
      },
      {
        "id": "talk-1",
        "english": "talk",
        "translation": "говорить",
        "category": "verbs",
        "subcategory": "regularVerbs",
        "tags": [
          "common"
        ]
      },
      {
        "id": "work-1",
        "english": "work",
        "translation": "работать",
        "category": "verbs",
        "subcategory": "regularVerbs",
        "tags": [
          "common"
        ]
      },
      {
        "id": "like-1",
        "english": "like",
        "translation": "нравиться",
        "category": "verbs",
        "subcategory": "regularVerbs",
        "tags": [
          "common"
        ]
      },
      {
        "id": "live-1",
        "english": "live",
        "translation": "жить",
        "category": "verbs",
        "subcategory": "regularVerbs",
        "tags": [
          "common"
        ]
      },
      {
        "id": "clean-1",
        "english": "clean",
        "translation": "убирать",
        "category": "verbs",
        "subcategory": "regularVerbs",
        "tags": [
          "common"
        ]
      },
      {
        "id": "open-1",
        "english": "open",
        "translation": "открывать",
        "category": "verbs",
        "subcategory": "regularVerbs",
        "tags": [
          "common"
        ]
      },
      {
        "id": "close-1",
        "english": "close",
        "translation": "закрывать",
        "category": "verbs",
        "subcategory": "regularVerbs",
        "tags": [
          "common"
        ]
      },
      {
        "id": "help-1",
        "english": "help",
        "translation": "помогать",
        "category": "verbs",
        "subcategory": "regularVerbs",
        "tags": [
          "common"
        ]
      },
      {
        "id": "start-1",
        "english": "start",
        "translation": "начинать",
        "category": "verbs",
        "subcategory": "regularVerbs",
        "tags": [
          "common"
        ]
      },
      {
        "id": "finish-1",
        "english": "finish",
        "translation": "заканчивать",
        "category": "verbs",
        "subcategory": "regularVerbs",
        "tags": [
          "common"
        ]
      },
      {
        "id": "visit-1",
        "english": "visit",
        "translation": "навещать",
        "category": "verbs",
        "subcategory": "regularVerbs",
        "tags": [
          "common"
        ]
      },
      {
        "id": "call-1",
        "english": "call",
        "translation": "звонить",
        "category": "verbs",
        "subcategory": "regularVerbs",
        "tags": [
          "common"
        ]
      },
      {
        "id": "look-1",
        "english": "look",
        "translation": "смотреть",
        "category": "verbs",
        "subcategory": "regularVerbs",
        "tags": [
          "common"
        ]
      },
      {
        "id": "walk-1",
        "english": "walk",
        "translation": "идти пешком",
        "category": "verbs",
        "subcategory": "regularVerbs",
        "tags": [
          "common"
        ]
      },
      {
        "id": "wait-1",
        "english": "wait",
        "translation": "ждать",
        "category": "verbs",
        "subcategory": "regularVerbs",
        "tags": [
          "common"
        ]
      },
      {
        "id": "cook-1",
        "english": "cook",
        "translation": "готовить",
        "category": "verbs",
        "subcategory": "regularVerbs",
        "tags": [
          "common"
        ]
      },
      {
        "id": "dance-1",
        "english": "dance",
        "translation": "танцевать",
        "category": "verbs",
        "subcategory": "regularVerbs",
        "tags": [
          "common"
        ]
      },
      {
        "id": "did-1",
        "english": "did",
        "translation": "сделал (вопросы/отрицания в Past Simple)",
        "category": "verbs",
        "subcategory": "auxiliaryVerbs",
        "tags": [
          "common"
        ]
      }
    ]
  }
}
